{
  "by_variant": {
    "extent_identity_inline_path": {
      "anonymous_fallback_with_both_copies_invalid": 0,
      "anonymous_full_recovery_count": 0,
      "archive_byte_size": 20252,
      "average_factored_entry_cost": 0.0,
      "basename_dictionary_bytes": 0,
      "conflict_fail_closed_count": 0,
      "detected_generation_mismatch_count": 0,
      "dictionary_total_bytes": 0,
      "directory_dictionary_bytes": 0,
      "estimated_dictionary_savings_vs_non_factored_header_tail": 11852,
      "file_binding_table_bytes": 0,
      "named_recovery_count": 12,
      "no_verified_evidence_count": 0,
      "orphan_evidence_count": 0,
      "overhead_delta_vs_extent_identity_inline_path": 0,
      "overhead_delta_vs_extent_identity_path_dict_header_tail": -11852,
      "overhead_delta_vs_payload_plus_manifest": -16296,
      "partial_ordered_recovery_count": 0,
      "partial_unordered_recovery_count": 0,
      "rejected_hash_mismatch_count": 0,
      "rejected_wrong_archive_count": 0,
      "scenario_count": 12,
      "successful_named_recovery_with_one_copy_invalid": 6,
      "valid_dictionary_copy_count": 0
    },
    "extent_identity_path_dict_factored_header_tail": {
      "anonymous_fallback_with_both_copies_invalid": 3,
      "anonymous_full_recovery_count": 6,
      "archive_byte_size": 33616,
      "average_factored_entry_cost": 0.0,
      "basename_dictionary_bytes": 0,
      "conflict_fail_closed_count": 3,
      "detected_generation_mismatch_count": 0,
      "dictionary_total_bytes": 0,
      "directory_dictionary_bytes": 0,
      "estimated_dictionary_savings_vs_non_factored_header_tail": -1512,
      "file_binding_table_bytes": 0,
      "named_recovery_count": 6,
      "no_verified_evidence_count": 0,
      "orphan_evidence_count": 0,
      "overhead_delta_vs_extent_identity_inline_path": 13364,
      "overhead_delta_vs_extent_identity_path_dict_header_tail": 1512,
      "overhead_delta_vs_payload_plus_manifest": -2932,
      "partial_ordered_recovery_count": 0,
      "partial_unordered_recovery_count": 0,
      "rejected_hash_mismatch_count": 0,
      "rejected_wrong_archive_count": 0,
      "scenario_count": 12,
      "successful_named_recovery_with_one_copy_invalid": 6,
      "valid_dictionary_copy_count": 0
    },
    "extent_identity_path_dict_header_tail": {
      "anonymous_fallback_with_both_copies_invalid": 3,
      "anonymous_full_recovery_count": 6,
      "archive_byte_size": 32104,
      "average_factored_entry_cost": 0.0,
      "basename_dictionary_bytes": 0,
      "conflict_fail_closed_count": 3,
      "detected_generation_mismatch_count": 0,
      "dictionary_total_bytes": 0,
      "directory_dictionary_bytes": 0,
      "estimated_dictionary_savings_vs_non_factored_header_tail": 0,
      "file_binding_table_bytes": 0,
      "named_recovery_count": 6,
      "no_verified_evidence_count": 0,
      "orphan_evidence_count": 0,
      "overhead_delta_vs_extent_identity_inline_path": 11852,
      "overhead_delta_vs_extent_identity_path_dict_header_tail": 0,
      "overhead_delta_vs_payload_plus_manifest": -4444,
      "partial_ordered_recovery_count": 0,
      "partial_unordered_recovery_count": 0,
      "rejected_hash_mismatch_count": 0,
      "rejected_wrong_archive_count": 0,
      "scenario_count": 12,
      "successful_named_recovery_with_one_copy_invalid": 6,
      "valid_dictionary_copy_count": 0
    },
    "payload_plus_manifest": {
      "anonymous_fallback_with_both_copies_invalid": 0,
      "anonymous_full_recovery_count": 0,
      "archive_byte_size": 36548,
      "average_factored_entry_cost": 0.0,
      "basename_dictionary_bytes": 0,
      "conflict_fail_closed_count": 0,
      "detected_generation_mismatch_count": 0,
      "dictionary_total_bytes": 0,
      "directory_dictionary_bytes": 0,
      "estimated_dictionary_savings_vs_non_factored_header_tail": -4444,
      "file_binding_table_bytes": 0,
      "named_recovery_count": 12,
      "no_verified_evidence_count": 0,
      "orphan_evidence_count": 0,
      "overhead_delta_vs_extent_identity_inline_path": 16296,
      "overhead_delta_vs_extent_identity_path_dict_header_tail": 4444,
      "overhead_delta_vs_payload_plus_manifest": 0,
      "partial_ordered_recovery_count": 0,
      "partial_unordered_recovery_count": 0,
      "rejected_hash_mismatch_count": 0,
      "rejected_wrong_archive_count": 0,
      "scenario_count": 12,
      "successful_named_recovery_with_one_copy_invalid": 6,
      "valid_dictionary_copy_count": 0
    }
  },
  "grouped_breakdown": {
    "corruption_target": {
      "both_dictionaries": {
        "extent_identity_inline_path": {
          "anonymous_full_recovery_count": 0,
          "named_recovery_count": 3,
          "scenario_count": 3
        },
        "extent_identity_path_dict_factored_header_tail": {
          "anonymous_full_recovery_count": 3,
          "named_recovery_count": 0,
          "scenario_count": 3
        },
        "extent_identity_path_dict_header_tail": {
          "anonymous_full_recovery_count": 3,
          "named_recovery_count": 0,
          "scenario_count": 3
        },
        "payload_plus_manifest": {
          "anonymous_full_recovery_count": 0,
          "named_recovery_count": 3,
          "scenario_count": 3
        }
      },
      "inconsistent_dictionaries": {
        "extent_identity_inline_path": {
          "anonymous_full_recovery_count": 0,
          "named_recovery_count": 3,
          "scenario_count": 3
        },
        "extent_identity_path_dict_factored_header_tail": {
          "anonymous_full_recovery_count": 3,
          "named_recovery_count": 0,
          "scenario_count": 3
        },
        "extent_identity_path_dict_header_tail": {
          "anonymous_full_recovery_count": 3,
          "named_recovery_count": 0,
          "scenario_count": 3
        },
        "payload_plus_manifest": {
          "anonymous_full_recovery_count": 0,
          "named_recovery_count": 3,
          "scenario_count": 3
        }
      },
      "mirrored_dictionary": {
        "extent_identity_inline_path": {
          "anonymous_full_recovery_count": 0,
          "named_recovery_count": 3,
          "scenario_count": 3
        },
        "extent_identity_path_dict_factored_header_tail": {
          "anonymous_full_recovery_count": 0,
          "named_recovery_count": 3,
          "scenario_count": 3
        },
        "extent_identity_path_dict_header_tail": {
          "anonymous_full_recovery_count": 0,
          "named_recovery_count": 3,
          "scenario_count": 3
        },
        "payload_plus_manifest": {
          "anonymous_full_recovery_count": 0,
          "named_recovery_count": 3,
          "scenario_count": 3
        }
      },
      "primary_dictionary": {
        "extent_identity_inline_path": {
          "anonymous_full_recovery_count": 0,
          "named_recovery_count": 3,
          "scenario_count": 3
        },
        "extent_identity_path_dict_factored_header_tail": {
          "anonymous_full_recovery_count": 0,
          "named_recovery_count": 3,
          "scenario_count": 3
        },
        "extent_identity_path_dict_header_tail": {
          "anonymous_full_recovery_count": 0,
          "named_recovery_count": 3,
          "scenario_count": 3
        },
        "payload_plus_manifest": {
          "anonymous_full_recovery_count": 0,
          "named_recovery_count": 3,
          "scenario_count": 3
        }
      }
    },
    "dataset": {
      "largefiles": {
        "extent_identity_inline_path": {
          "anonymous_full_recovery_count": 0,
          "named_recovery_count": 4,
          "scenario_count": 4
        },
        "extent_identity_path_dict_factored_header_tail": {
          "anonymous_full_recovery_count": 2,
          "named_recovery_count": 2,
          "scenario_count": 4
        },
        "extent_identity_path_dict_header_tail": {
          "anonymous_full_recovery_count": 2,
          "named_recovery_count": 2,
          "scenario_count": 4
        },
        "payload_plus_manifest": {
          "anonymous_full_recovery_count": 0,
          "named_recovery_count": 4,
          "scenario_count": 4
        }
      },
      "mixed": {
        "extent_identity_inline_path": {
          "anonymous_full_recovery_count": 0,
          "named_recovery_count": 4,
          "scenario_count": 4
        },
        "extent_identity_path_dict_factored_header_tail": {
          "anonymous_full_recovery_count": 2,
          "named_recovery_count": 2,
          "scenario_count": 4
        },
        "extent_identity_path_dict_header_tail": {
          "anonymous_full_recovery_count": 2,
          "named_recovery_count": 2,
          "scenario_count": 4
        },
        "payload_plus_manifest": {
          "anonymous_full_recovery_count": 0,
          "named_recovery_count": 4,
          "scenario_count": 4
        }
      },
      "smallfiles": {
        "extent_identity_inline_path": {
          "anonymous_full_recovery_count": 0,
          "named_recovery_count": 4,
          "scenario_count": 4
        },
        "extent_identity_path_dict_factored_header_tail": {
          "anonymous_full_recovery_count": 2,
          "named_recovery_count": 2,
          "scenario_count": 4
        },
        "extent_identity_path_dict_header_tail": {
          "anonymous_full_recovery_count": 2,
          "named_recovery_count": 2,
          "scenario_count": 4
        },
        "payload_plus_manifest": {
          "anonymous_full_recovery_count": 0,
          "named_recovery_count": 4,
          "scenario_count": 4
        }
      }
    },
    "path_length_bucket": {
      "normal": {
        "extent_identity_inline_path": {
          "anonymous_full_recovery_count": 0,
          "named_recovery_count": 12,
          "scenario_count": 12
        },
        "extent_identity_path_dict_factored_header_tail": {
          "anonymous_full_recovery_count": 6,
          "named_recovery_count": 6,